Course,Tag
Curso de Asincronismo con JavaScript,frontend
Curso Profesional de JavaScript,frontend
Curso Práctico de React JS,frontend
Curso de React Router y Redux,frontend
Curso de Fundamentos de Node.js,frontend
Curso de Backend con Node.js,frontend
Curso de Server Side Render con Express,frontend
Curso de Autenticación con Passport.js,frontend
Curso de Integración de Backend y Frontend,frontend
Curso de Creación de Portafolio y CV,frontend
Curso Profesional de Git y GitHub,frontend
Fundamentos de Bases de Datos,ai-ml
Curso de Administración de Servidores Linux,ai-ml
Fundamentos de C# con NET Core,ai-ml
Curso de C# con .Net Core,ai-ml
Curso de ASP.NET Core,ai-ml
Curso de Azure IaaS,ai-ml
Curso de Almacenamiento en Azure,ai-ml
Curso de SQL en Azure,ai-ml
Curso de Web Apps y Logic Apps en Azure,ai-ml
Curso de Microsoft Flow,ai-ml
Curso de Introducción a la Web: Historia y Funcionamiento de Internet,frontend
Curso Definitivo de HTML y CSS,frontend
Curso Profesional de Git y GitHub,frontend
Curso Práctico de HTML y CSS,frontend
Curso de Flujo de Desarrollo Moderno CodeStream,frontend
Curso de Sistemas de Diseño,frontend
Curso de Responsive Design: Maquetación Mobile First,frontend
Curso de CSS Grid Layout,frontend
Curso de Debugging con Chrome DevTools,frontend
Curso de Frontend Developer,frontend
Curso Básico de JavaScript,frontend
Curso de JavaScript Engine (V8) y el Navegador,frontend
Curso de ECMAScript 6+,frontend
Curso de Closures y Scope en JavaScript,frontend
Curso de Asincronismo con JavaScript,frontend
Curso de Estructuras de Datos con JavaScript,frontend
Curso Profesional de JavaScript,frontend
Curso de Accesibilidad Web,frontend
Curso de Single Page Application con JavaScript Vanilla,frontend
Taller de Creación de Router para Single Page App con JavaScript,frontend
Curso de Gestión de Dependencias y Paquetes con NPM,frontend
Curso de Webpack,frontend
Curso de Postman,frontend
Curso de JavaScript Testing con Jest 2019,frontend
Curso de Optimización Web,frontend
Curso de Preprocesadores CSS,frontend
Curso de Sass,frontend
Curso de React.js,frontend
Curso Práctico de React JS,frontend
Curso de React Router y Redux,frontend
Curso de React Avanzado,frontend
Curso Profesional de React Hooks,frontend
Curso de Fundamentos de TypeScript,frontend
Curso de Angular,frontend
Curso Profesional de Angular,frontend
Curso Básico de Vue.js,frontend
Curso Avanzado de Vue.js,frontend
Curso Profesional de Vue.js,frontend
Curso de Svelte,frontend
Curso de Sapper,frontend
Curso de Desarrollo Web con Svelte y Sapper,frontend
Curso de Fundamentos de Node.js,frontend
Curso de Introducción al Despliegue de Aplicaciones,frontend
Curso de Node.js,frontend
Curso Práctico de Node.js,frontend
Curso de Backend con Node.js,frontend
Curso Avanzado de Node.js,frontend
Curso de Server Side Render con Express,frontend
Curso de Autenticación con Passport.js,frontend
Curso de Integración de Backend y Frontend,frontend
Curso de Next.js,frontend
Curso Práctico de Arquitectura Backend,frontend
Curso de Pensamiento Lógico,fundamentos
Curso de Fundamentos de Matemáticas,fundamentos
Curso de Álgebra,fundamentos
Fundamentos de Matemáticas para Física,fundamentos
Curso de Cálculo para Análisis de Datos,fundamentos
Curso de Cálculo Integral: Integrales Directas,fundamentos
Curso de Cálculo Integral: Integrales por Sustitución,fundamentos
Curso de Cálculo Integral: Integración por Partes,fundamentos
Curso de Cálculo Multivariable,fundamentos
Curso de Ecuaciones Diferenciales,fundamentos
Curso Básico de Python,fundamentos
Curso de Introducción al Pensamiento Computacional con Python,fundamentos
Curso de POO y Algoritmos con Python,fundamentos
Curso de Estadística Computacional con Python,fundamentos
Curso de Introducción al Pensamiento Probabilístico,fundamentos
Curso de Matemáticas para Data Science: Cálculo,fundamentos
Curso de Matemáticas para Data Science: Probabilidad,fundamentos
Curso de Introducción al Álgebra Lineal: Vectores,fundamentos
Curso de Fundamentos de Álgebra Lineal con Python,fundamentos
Curso de Física Mecánica Estática,fundamentos
Curso de Matemáticas Discretas,fundamentos
Taller de Aplicación de Modelos Numéricos,fundamentos
